{
  "schema_version": "dataset-manifest-v1",
  "manifest_id": "floodnet-segmentation-v1",
  "dataset_id": "floodnet",
  "task_type": "SEMANTIC_SEGMENTATION",
  "source_version": "synthetic-fixture",
  "preparation_version": "segmentation_v1",
  "taxonomy_version": "segmentation-taxonomy-v1",
  "integrity_mode": "full",
  "created_at": "2026-01-01T00:00:00Z",
  "tool_version": "0.3.0",
  "fingerprint": "aaaaaaaaaaaaaaaaaaaaaaaaaaaaaaaaaaaaaaaaaaaaaaaaaaaaaaaaaaaaaaaa",
  "samples": [
    {
      "sample_id": "floodnet-train-example",
      "source_dataset": "floodnet",
      "source_split": "train",
      "target_split": "train",
      "image_path": "raw/floodnet/train/images/example.jpg",
      "source_annotation_path": "raw/floodnet/train/masks/example.png",
      "target_annotation_path": "processed/segmentation_v1/floodnet/train/masks/example.png",
      "width": 4,
      "height": 4,
      "image_hash": "bbbbbbbbbbbbbbbbbbbbbbbbbbbbbbbbbbbbbbbbbbbbbbbbbbbbbbbbbbbbbbbb",
      "annotation_hash": "cccccccccccccccccccccccccccccccccccccccccccccccccccccccccccccccc",
      "class_counts": {"0": 8, "1": 8},
      "ignored_count": 0,
      "invalid_count": 0,
      "preparation_version": "segmentation_v1",
      "taxonomy_version": "segmentation-taxonomy-v1",
      "objects": []
    }
  ]
}
